{
    "name": "Carlos Rodriguez",
    "first name": "Carlos",
    "last name": "Rodriguez",
    "age": 35,
    "innate": "analytical, strategic thinker",
    "occupation": "Software Engineer",
    "origin": "Spain",
    "gender": "male",
    "description": "Carlos Rodriguez is a 35-year-old software engineer hailing from Spain. Carlos is recognized for his analytical prowess and strategic thinking in the dynamic world of technology. With a strong educational background in computer science from the Universidad Polit√©cnica de Madrid, he has honed his skills and expertise over the years.\n\nCarlos has contributed significantly to the development of cutting-edge software solutions, working with multinational tech companies. His innovative approach to problem-solving and meticulous coding practices have not only earned him professional acclaim but have also positioned him as a mentor within his teams.\n\nOutside of his professional pursuits, Carlos is an avid advocate for STEM education, often participating in community outreach programs to inspire the next generation of technologists. His commitment to excellence, paired with a genuine passion for sharing knowledge, marks Carlos Rodriguez as a driving force in the ever-evolving landscape of software engineering."
}