{
    "name": "Janice Thompson",
    "first name": "Janice",
    "last name": "Thompson",
    "age": 53,
    "innate": "compassionate, resilient",
    "occupation": "Community Organizer",
    "origin": "United States",
    "gender": "female",
    "description": "Janice Thompson is a compassionate and resilient 53-year-old African-American community organizer from the United States. Janice's life has been dedicated to fostering positive change and empowering marginalized communities through her tireless efforts.\n\nWith a background in social work and community development, Janice has been at the forefront of numerous initiatives aimed at addressing social inequalities. Her innate compassion and ability to connect with people have made her a trusted advocate for those in need.\n\nJanice's work extends beyond her official role as a community organizer; she actively mentors young individuals, encouraging them to pursue their dreams despite adversities. Her commitment to creating a more equitable society has earned her recognition and respect within both local and national circles.\n\nOutside of her activism, Janice finds solace in the arts, enjoying literature and supporting local artists. Janice Thompson stands as a beacon of strength and inspiration, embodying the spirit of resilience and compassion in the ongoing pursuit of social justice."
}