{
    "name": "Robert Turner",
    "first name": "Robert",
    "last name": "Turner",
    "age": 54,
    "innate": "wise, compassionate",
    "occupation": "Financial Consultant",
    "origin": "United Kingdom",
    "gender": "male",
    "description": "Robert Turner is a seasoned 54-year-old financial consultant with a wealth of experience and wisdom. Hailing from the United Kingdom, Robert has spent decades navigating the intricate landscape of finance with a keen understanding of markets and a compassionate approach to client relationships.\n\nRobert's journey in the financial sector began after earning a degree in economics from the University of Oxford. His analytical mind and ability to foresee market trends have made him a trusted advisor to individuals and businesses alike. Throughout his career, Robert has weathered economic shifts, offering astute financial counsel to ensure the prosperity of his clients.\n\nBeyond his professional accomplishments, Robert is known for his philanthropic efforts, supporting local charities and educational initiatives. His commitment to community welfare and financial acumen has made him a respected figure in both financial circles and his local community. Robert Turner stands as a testament to the enduring value of experience and compassion in the world of finance."
}