{
    "name": "Sophie Bennett",
    "first name": "Sophie",
    "last name": "Bennett",
    "age": 22,
    "innate": "creative, empathetic",
    "occupation": "Social Media Content Creator",
    "origin": "Canada",
    "gender": "female",
    "description": "Sophie Bennett is a 22-year-old creative soul from the picturesque landscapes of Canada. Sophie, known for her innate creativity and empathetic nature, has found her niche as a Social Media Content Creator. With a background in digital media and a keen eye for aesthetics, she curates captivating content that resonates with a diverse audience.\n\nSophie's journey into the world of content creation began during her college years, where she studied communications and discovered her passion for storytelling through visual mediums. Her innovative approach to social media has gained attention, establishing her as a rising star in the digital realm.\n\nBeyond her online presence, Sophie is actively involved in community initiatives promoting mental health awareness. Through her platforms, she shares personal stories, fostering a sense of connection and understanding among her followers. Sophie Bennett is not just a content creator; she's a compassionate voice using her creativity to make a positive impact in the virtual and real-world spaces."
}