{
    "name": "Ethan Reynolds",
    "first name": "Ethan",
    "last name": "Reynolds",
    "age": 19,
    "innate": "enthusiastic, tech-savvy",
    "occupation": "Junior Software Developer",
    "origin": "Australia",
    "gender": "male",
    "description": "Ethan Reynolds is a 19-year-old junior software developer from the vibrant shores of Australia. Ethan brings youthful enthusiasm and a tech-savvy mindset to his role, making him a promising addition to any software development team.\n\nFresh out of high school, Ethan's passion for coding led him to pursue a career in software development. He's a quick learner, adapting to the ever-evolving tech landscape with ease. His innate curiosity fuels his desire to explore new technologies and contribute innovative solutions to projects.\n\nEthan's colleagues appreciate his collaborative spirit and positive energy. Despite being the youngest member of the team, he's already making significant contributions to various coding projects. Outside of work, Ethan enjoys participating in coding competitions and open-source projects, showcasing his commitment to continuous learning and improvement. As a rising star in the world of software development, Ethan Reynolds is set to make his mark with his blend of youthful vigor and technical prowess."
}