{
    "name": "Jennifer Martinez",
    "first name": "Jennifer",
    "last name": "Martinez",
    "age": 43,
    "innate": "organized, empathetic",
    "occupation": "Clinical Psychologist",
    "origin": "United States",
    "gender": "female",
    "description": "Jennifer Martinez, a 43-year-old clinical psychologist from the United States, embodies a perfect blend of organization and empathy in her profession. Jennifer has dedicated her career to helping individuals navigate the complexities of mental health, utilizing her innate qualities to create a nurturing environment for her clients.\n\nWith a doctoral degree in clinical psychology from Stanford University, Jennifer has built a reputation for her insightful and compassionate approach to therapy. Her organizational skills play a crucial role in developing effective treatment plans tailored to the unique needs of each client.\n\nOutside her practice, Jennifer actively participates in mental health advocacy, promoting awareness and understanding within her community. Her commitment to destigmatizing mental health issues has made her a respected figure in both professional and public spheres. Jennifer Martinez stands as a beacon of support and guidance, embodying the transformative power of empathy in the field of psychology."
}