{
    "name": "Kazuki Tanaka",
    "first name": "Kazuki",
    "last name": "Tanaka",
    "age": 42,
    "innate": "disciplined, visionary",
    "occupation": "Technology Entrepreneur",
    "origin": "Japan",
    "gender": "male",
    "description": "Kazuki Tanaka is a disciplined and visionary 42-year-old technology entrepreneur hailing from the innovation-rich landscape of Japan. Kazuki's journey is marked by a blend of traditional values and a forward-thinking mindset, making him a notable figure in the tech industry.\n\nArmed with a degree in computer science from the University of Tokyo, Kazuki ventured into the tech world at a young age. His disciplined work ethic and strategic vision have propelled him to establish and lead successful tech ventures. Kazuki is known for his commitment to pushing the boundaries of technological innovation, with a focus on creating solutions that positively impact society.\n\nBeyond his professional endeavors, Kazuki is an advocate for promoting STEM education in Japan, aiming to inspire the next generation of tech enthusiasts. He balances his ambitious career with a deep appreciation for traditional Japanese arts and culture. Kazuki Tanaka stands as a bridge between the rich heritage of Japan and the cutting-edge possibilities of the future in the dynamic world of technology."
}