{
    "name": "Olivia Anderson",
    "first name": "Olivia",
    "last name": "Anderson",
    "age": 38,
    "innate": "nurturing, resilient",
    "occupation": "Elementary School Teacher",
    "origin": "Canada",
    "gender": "female",
    "description": "Olivia Anderson is a resilient and nurturing 38-year-old elementary school teacher from the picturesque landscapes of Canada. Olivia's days are a harmonious blend of guiding young minds in the classroom and embracing the joys of motherhood at home.\n\nWith a degree in education and a specialization in early childhood development, Olivia has dedicated her career to creating a positive and engaging learning environment. Her innate nurturing qualities extend beyond the classroom, where she balances the responsibilities of being a dedicated mother to her two children.\n\nOlivia is known for her creative teaching methods, fostering a love for learning in her students. Her colleagues and parents alike appreciate her compassionate approach to education. Outside of work, she enjoys spending quality time with her family, exploring nature trails, and instilling a sense of curiosity in her children. Olivia Anderson stands as a pillar of strength and compassion, leaving a lasting impact on the young minds she guides and the family she cherishes."
}